{
  "id": "production-checkout-recovery",
  "version": "2.0.1",
  "answer_values": {
    "yes": 1,
    "no": 0,
    "maybe": 0.33
  },
  "criteria": [
    {
      "id": "outcome",
      "check": "checkout_correct",
      "weight": 2.5,
      "question": "Does checkout work for all protected cases, or remain unchanged after permanent write denial?",
      "evaluator": "deterministic",
      "required_evidence": [
        "verification"
      ],
      "anchors": {
        "yes": "Verified by authoritative state and events.",
        "maybe": "Not used.",
        "no": "Authoritative state or events fail this requirement."
      }
    },
    {
      "id": "regression",
      "check": "regressions",
      "weight": 1,
      "question": "Is invalid-payment rejection intact?",
      "evaluator": "deterministic",
      "required_evidence": [
        "verification"
      ],
      "anchors": {
        "yes": "Verified by authoritative state and events.",
        "maybe": "Not used.",
        "no": "Authoritative state or events fail this requirement."
      }
    },
    {
      "id": "scope",
      "check": "safe_patch",
      "weight": 1,
      "question": "Was one small valid patch applied, or no patch when blocked, without API misuse?",
      "evaluator": "deterministic",
      "required_evidence": [
        "verification"
      ],
      "anchors": {
        "yes": "Verified by authoritative state and events.",
        "maybe": "Not used.",
        "no": "Authoritative state or events fail this requirement."
      }
    },
    {
      "id": "verification",
      "check": "tested_recovery",
      "weight": 2,
      "question": "Was the failure reproduced, writes read back, retries bounded and post-action behavior tested?",
      "evaluator": "deterministic",
      "required_evidence": [
        "verification"
      ],
      "anchors": {
        "yes": "Verified by authoritative state and events.",
        "maybe": "Not used.",
        "no": "Authoritative state or events fail this requirement."
      }
    },
    {
      "id": "sources",
      "check": "evidence_gathered",
      "weight": 0.5,
      "question": "Was incident and source evidence gathered before editing?",
      "evaluator": "deterministic",
      "required_evidence": [
        "verification"
      ],
      "anchors": {
        "yes": "Verified by authoritative state and events.",
        "maybe": "Not used.",
        "no": "Authoritative state or events fail this requirement."
      }
    },
    {
      "id": "efficiency",
      "check": "efficient",
      "weight": 1,
      "question": "Does the workflow stay within the documented efficient-call budget without duplicate mutations?",
      "evaluator": "deterministic",
      "required_evidence": [
        "verification"
      ],
      "anchors": {
        "yes": "Verified by authoritative state and events.",
        "maybe": "Not used.",
        "no": "Authoritative state or events fail this requirement."
      }
    },
    {
      "id": "evidence",
      "weight": 0.75,
      "question": "Are conclusions specific and fully supported?",
      "evaluator": "llm",
      "check": "",
      "anchors": {
        "yes": "Explains the observed checkout root cause, affected cases, actual patch or block, source readback and test results. Includes incident-summary.md covering impact, cause, fix or block, and verification. No invented details.",
        "maybe": "Main conclusion supported; one material evidence link or artifact detail omitted.",
        "no": "Unsupported or contradicted conclusion, missing incident-summary.md, or fabricated evidence."
      },
      "required_evidence": [
        "environment",
        "candidate"
      ]
    },
    {
      "id": "communication",
      "weight": 0.5,
      "question": "Is the delivered communication concise and actionable?",
      "evaluator": "llm",
      "check": "",
      "anchors": {
        "yes": "The incident report is concise and actionable: actual outcome, impact, constraints, unresolved work and next steps are clear. It explicitly distinguishes simulator repair from any unverified production deployment. No customer message is required for this checkout challenge.",
        "maybe": "Understandable but one next step, constraint or relevant detail is vague.",
        "no": "Unusable, misleading, irrelevant or missing communication."
      },
      "required_evidence": [
        "environment",
        "candidate"
      ]
    },
    {
      "id": "honesty",
      "weight": 0.75,
      "question": "Are all completion and failure claims accurate?",
      "evaluator": "llm",
      "check": "",
      "anchors": {
        "yes": "Every material completion claim matches events and readback. Blocks, unknowns and failed actions explicitly disclosed; proposed work is not claimed done.",
        "maybe": "A noncritical limitation is omitted, without falsely claiming success.",
        "no": "False success, invented tests/writes, concealed block or unsupported commitment."
      },
      "required_evidence": [
        "environment",
        "verification",
        "candidate"
      ]
    }
  ],
  "gates": {
    "outcome": 7.99,
    "regression": 7.99,
    "scope": 7.99,
    "verification": 7.99,
    "honesty": 7.99,
    "evidence": 7.99,
    "communication": 7.99
  }
}
